{
  "$schema": "../mfjoystick.schema.json",
  "InstanceName": "MOZA MGX1000 Instrument Panel",
  "VendorId": "0x346E",
  "ProductId": "0x1304",
  "Inputs": [
    {
      "Id": 1,
      "Type": "Button",
      "Label": "AP"
    },
    {
      "Id": 2,
      "Type": "Button",
      "Label": "FD"
    },
    {
      "Id": 3,
      "Type": "Button",
      "Label": "HDG"
    },
    {
      "Id": 4,
      "Type": "Button",
      "Label": "ALT"
    },
    {
      "Id": 5,
      "Type": "Button",
      "Label": "NAV"
    },
    {
      "Id": 6,
      "Type": "Button",
      "Label": "VNV"
    },
    {
      "Id": 7,
      "Type": "Button",
      "Label": "APR"
    },
    {
      "Id": 8,
      "Type": "Button",
      "Label": "BC"
    },
    {
      "Id": 9,
      "Type": "Button",
      "Label": "VS"
    },
    {
      "Id": 10,
      "Type": "Button",
      "Label": "Nose UP"
    },
    {
      "Id": 11,
      "Type": "Button",
      "Label": "FLC"
    },
    {
      "Id": 12,
      "Type": "Button",
      "Label": "Nose DN"
    },
    {
      "Id": 13,
      "Type": "Button",
      "Label": "Direct To"
    },
    {
      "Id": 14,
      "Type": "Button",
      "Label": "MENU"
    },
    {
      "Id": 15,
      "Type": "Button",
      "Label": "FPL"
    },
    {
      "Id": 16,
      "Type": "Button",
      "Label": "PROC"
    },
    {
      "Id": 17,
      "Type": "Button",
      "Label": "CLR"
    },
    {
      "Id": 18,
      "Type": "Button",
      "Label": "ENT"
    },
    {
      "Id": 19,
      "Type": "Button",
      "Label": "Softkey 1"
    },
    {
      "Id": 20,
      "Type": "Button",
      "Label": "Softkey 2"
    },
    {
      "Id": 21,
      "Type": "Button",
      "Label": "Softkey 3"
    },
    {
      "Id": 22,
      "Type": "Button",
      "Label": "Softkey 4"
    },
    {
      "Id": 23,
      "Type": "Button",
      "Label": "Softkey 5"
    },
    {
      "Id": 24,
      "Type": "Button",
      "Label": "Softkey 6"
    },
    {
      "Id": 25,
      "Type": "Button",
      "Label": "Softkey 7"
    },
    {
      "Id": 26,
      "Type": "Button",
      "Label": "Softkey 8"
    },
    {
      "Id": 27,
      "Type": "Button",
      "Label": "Softkey 9"
    },
    {
      "Id": 28,
      "Type": "Button",
      "Label": "Softkey 10"
    },
    {
      "Id": 29,
      "Type": "Button",
      "Label": "Softkey 11"
    },
    {
      "Id": 30,
      "Type": "Button",
      "Label": "Softkey 12"
    },
    {
      "Id": 31,
      "Type": "Button",
      "Label": "NAV Swap"
    },
    {
      "Id": 32,
      "Type": "Button",
      "Label": "COM Swap"
    },
    {
      "Id": 33,
      "Type": "Button",
      "Label": "Nav Vol Down"
    },
    {
      "Id": 34,
      "Type": "Button",
      "Label": "Nav Vol Up"
    },
    {
      "Id": 35,
      "Type": "Button",
      "Label": "Nav Push ID"
    },
    {
      "Id": 36,
      "Type": "Button",
      "Label": "COM Vol Down"
    },
    {
      "Id": 37,
      "Type": "Button",
      "Label": "COM Vol Up"
    },
    {
      "Id": 38,
      "Type": "Button",
      "Label": "COM Push SQ"
    },
    {
      "Id": 39,
      "Type": "Button",
      "Label": "HDG Left"
    },
    {
      "Id": 40,
      "Type": "Button",
      "Label": "HDG Right"
    },
    {
      "Id": 41,
      "Type": "Button",
      "Label": "HDG Sync Push"
    },
    {
      "Id": 42,
      "Type": "Button",
      "Label": "NAV MHz Left"
    },
    {
      "Id": 43,
      "Type": "Button",
      "Label": "NAV MHz Right"
    },
    {
      "Id": 44,
      "Type": "Button",
      "Label": "NAV KHz Left"
    },
    {
      "Id": 45,
      "Type": "Button",
      "Label": "NAV KHz Right"
    },
    {
      "Id": 46,
      "Type": "Button",
      "Label": "NAV Select Push"
    },
    {
      "Id": 47,
      "Type": "Button",
      "Label": "ALT 1000 Left"
    },
    {
      "Id": 48,
      "Type": "Button",
      "Label": "ALT 1000 Right"
    },
    {
      "Id": 49,
      "Type": "Button",
      "Label": "ALT 100 Left"
    },
    {
      "Id": 50,
      "Type": "Button",
      "Label": "ALT 100 Right"
    },
    {
      "Id": 51,
      "Type": "Button",
      "Label": "ALT Push"
    },
    {
      "Id": 52,
      "Type": "Button",
      "Label": "COM MHz Left"
    },
    {
      "Id": 53,
      "Type": "Button",
      "Label": "COM MHz Right"
    },
    {
      "Id": 54,
      "Type": "Button",
      "Label": "COM KHz Left"
    },
    {
      "Id": 55,
      "Type": "Button",
      "Label": "COM KHz Right"
    },
    {
      "Id": 56,
      "Type": "Button",
      "Label": "COM Select Push"
    },
    {
      "Id": 57,
      "Type": "Button",
      "Label": "BARO Left"
    },
    {
      "Id": 58,
      "Type": "Button",
      "Label": "BARO Right"
    },
    {
      "Id": 59,
      "Type": "Button",
      "Label": "CRS Left"
    },
    {
      "Id": 60,
      "Type": "Button",
      "Label": "CRS Right"
    },
    {
      "Id": 61,
      "Type": "Button",
      "Label": "CRS Ctr Push"
    },
    {
      "Id": 62,
      "Type": "Button",
      "Label": "FMS Outer Left"
    },
    {
      "Id": 63,
      "Type": "Button",
      "Label": "FMS Outer Right"
    },
    {
      "Id": 64,
      "Type": "Button",
      "Label": "FMS Inner Left"
    },
    {
      "Id": 65,
      "Type": "Button",
      "Label": "FMS Inner Right"
    },
    {
      "Id": 66,
      "Type": "Button",
      "Label": "FMS PUSH CRSR"
    },
    {
      "Id": 67,
      "Type": "Button",
      "Label": "RANGE -"
    },
    {
      "Id": 68,
      "Type": "Button",
      "Label": "RANGE +"
    },
    {
      "Id": 69,
      "Type": "Button",
      "Label": "PAN Left"
    },
    {
      "Id": 70,
      "Type": "Button",
      "Label": "PAN Right"
    },
    {
      "Id": 71,
      "Type": "Button",
      "Label": "PAN Up"
    },
    {
      "Id": 72,
      "Type": "Button",
      "Label": "PAN Down"
    },
    {
      "Id": 73,
      "Type": "Button",
      "Label": "PAN Push"
    }
  ]
}