{
  "$schema": "./mfjoystick.schema.json",
  "InstanceName": "WINGFLEX FCU CUBE",
  "VendorId": "0xA316",
  "ProductId": "0xC787",
  "Inputs": [
    {
      "Id": 1,
      "Type": "Button",
      "Label": "SPD MACH Switch"
    },
    {
      "Id": 2,
      "Type": "Button",
      "Label": "SPD Knob Push"
    },
    {
      "Id": 3,
      "Type": "Button",
      "Label": "SPD Knob Pull"
    },
    {
      "Id": 4,
      "Type": "Button",
      "Label": "HDG TRK Switch"
    },
    {
      "Id": 5,
      "Type": "Button",
      "Label": "HDG Knob Push"
    },
    {
      "Id": 6,
      "Type": "Button",
      "Label": "HDG Knob Pull"
    },
    {
      "Id": 7,
      "Type": "Button",
      "Label": "ALT 100"
    },
    {
      "Id": 8,
      "Type": "Button",
      "Label": "ALT 1000"
    },
    {
      "Id": 9,
      "Type": "Button",
      "Label": "ALT Knob Push"
    },
    {
      "Id": 10,
      "Type": "Button",
      "Label": "ALT Knob Pull"
    },
    {
      "Id": 11,
      "Type": "Button",
      "Label": "VS Knob Push"
    },
    {
      "Id": 12,
      "Type": "Button",
      "Label": "VS Knob Pull"
    },
    {
      "Id": 13,
      "Type": "Button",
      "Label": "METRIC ALT"
    },
    {
      "Id": 14,
      "Type": "Button",
      "Label": "AP1"
    },
    {
      "Id": 15,
      "Type": "Button",
      "Label": "AP2"
    },
    {
      "Id": 16,
      "Type": "Button",
      "Label": "A/THR"
    },
    {
      "Id": 17,
      "Type": "Button",
      "Label": "LOC"
    },
    {
      "Id": 18,
      "Type": "Button",
      "Label": "EXPED"
    },
    {
      "Id": 19,
      "Type": "Button",
      "Label": "APPR"
    },
    {
      "Id": 20,
      "Type": "Button",
      "Label": "SPD Knob Rotate Left"
    },
    {
      "Id": 21,
      "Type": "Button",
      "Label": "SPD Knob Rotate Right"
    },
    {
      "Id": 22,
      "Type": "Button",
      "Label": "HDG Knob Rotate Left"
    },
    {
      "Id": 23,
      "Type": "Button",
      "Label": "HDG Knob Rotate Right"
    },
    {
      "Id": 24,
      "Type": "Button",
      "Label": "ALT Knob Rotate Left"
    },
    {
      "Id": 25,
      "Type": "Button",
      "Label": "ALT Knob Rotate Right"
    },
    {
      "Id": 26,
      "Type": "Button",
      "Label": "VS Knob Rotate Left"
    },
    {
      "Id": 27,
      "Type": "Button",
      "Label": "VS Knob Rotate Right"
    },
    {
      "Id": 48,
      "Type": "Axis",
      "Label": "Background Light Brightness"
    },
    {
      "Id": 49,
      "Type": "Axis",
      "Label": "LCD Light Brightness"
    }
  ],
  "Outputs": [
    {
      "Label": "LOC Signal",
      "Id": "LOC.signal",
      "Byte": 6,
      "Bit": 0
    },
    {
      "Label": "AP1 Signal",
      "Id": "AP1.signal",
      "Byte": 6,
      "Bit": 1
    },
    {
      "Label": "AP2 Signal",
      "Id": "AP2.signal",
      "Byte": 6,
      "Bit": 2
    },
    {
      "Label": "A/THR Signal",
      "Id": "ATHR.signal",
      "Byte": 6,
      "Bit": 3
    },
    {
      "Label": "EXPED Signal",
      "Id": "EXPED.signal",
      "Byte": 6,
      "Bit": 4
    },
    {
      "Label": "APPR Signal",
      "Id": "APPR.signal",
      "Byte": 6,
      "Bit": 5
    },
    {
      "Label": "SPD Managed",
      "Id": "SPD.managed",
      "Byte": 6,
      "Bit": 6
    },
    {
      "Label": "SPD Dashed",
      "Id": "SPD.dashed",
      "Byte": 6,
      "Bit": 7
    },
    {
      "Label": "HDG Managed",
      "Id": "HDG.managed",
      "Byte": 7,
      "Bit": 0
    },
    {
      "Label": "HDG Dashed",
      "Id": "HDG.dashed",
      "Byte": 7,
      "Bit": 1
    },
    {
      "Label": "ALT Managed",
      "Id": "ALT.managed",
      "Byte": 7,
      "Bit": 2
    },
    {
      "Label": "VS Dashed",
      "Id": "VS.dashed",
      "Byte": 7,
      "Bit": 3
    },
    {
      "Label": "SPD MACH Mode",
      "Id": "SPD.mach_mode",
      "Byte": 7,
      "Bit": 4
    },
    {
      "Label": "HDG V/S Mode",
      "Id": "HDG.vs_mode",
      "Byte": 7,
      "Bit": 5
    },
    {
      "Label": "Test Mode",
      "Id": "test_mode",
      "Byte": 7,
      "Bit": 6
    },
    {
      "Label": "Power",
      "Id": "power",
      "Byte": 8,
      "Bit": 0
    },
    {
      "Label": "Panel Brightness",
      "Id": "brightness.panel",
      "Byte": 11,
      "Bit": 0
    },
    {
      "Label": "Display Brightness",
      "Id": "brightness.display",
      "Byte": 12,
      "Bit": 0
    },
    {
      "Label": "SPD",
      "Id": "SPD.value",
      "Type": "LcdDisplay",
      "Byte": 15,
      "Cols": 5,
      "Lines": 1
    },
    {
      "Label": "HDG",
      "Id": "HDG.value",
      "Type": "LcdDisplay",
      "Byte": 17,
      "Cols": 3,
      "Lines": 1
    },
    {
      "Label": "ALT",
      "Id": "ALT.value",
      "Type": "LcdDisplay",
      "Byte": 19,
      "Cols": 5,
      "Lines": 1
    },
    {
      "Label": "V/S",
      "Id": "VS.value",
      "Type": "LcdDisplay",
      "Byte": 21,
      "Cols": 4,
      "Lines": 1
    }
  ]
}
